{
  "kind": "adrf-case",
  "adrf": "0.1",
  "object": {
    "ref": {
      "chainId": 11155111,
      "target": "0x00000000000000000000000000000000000e5c20",
      "id": 17,
      "versionHash": "0x803df172de351bd5a2aada3afdad56be67c9fc749e85257a9bba54fd2fed52ca"
    },
    "description": "service call 17 of the escrow, terms v1"
  },
  "event": {
    "eventRef": "0xbc06ebe2b69400cc4d7163a14266e22c11bda70a17e5b6e491931df471c7c597",
    "description": "the delivery of call 17",
    "eventAt": 1770003600
  },
  "claim": {
    "statement": "The delivery of call 17 does not conform to the acceptance criteria of the terms.",
    "proposition": "0x34ef2302e89c2926600e86fbde7487199ae740d351c3c9d36c18e90bdfd4a3db",
    "decisive": 0,
    "supportsWhen": "FALSE"
  },
  "rules": {
    "normRef": "0x161c9f18675063b2f431db7a75036c6a863e0c9ec21fb74f9117af1b32b6d85c",
    "normDescription": "service terms v1",
    "clause": "0x5c83831647b7479f84ef374060d1913e14275e7f7469d26afa220a18687a919a",
    "clauseText": "the deliverable conforms to the acceptance criteria",
    "obligationKind": {
      "code": 1,
      "label": "result"
    },
    "policyId": "0x54023f33233bb11abac349a2117482508fa4df106f3753f136c26c93e6007574"
  },
  "subjects": {
    "claimant": "0x000000000000000000000000000000000000c11e",
    "respondent": "0x00000000000000000000000000000000000009a0",
    "roles": [
      {
        "account": "0x000000000000000000000000000000000000c11e",
        "role": "client"
      },
      {
        "account": "0x00000000000000000000000000000000000009a0",
        "role": "provider"
      }
    ]
  },
  "authorization": {
    "effectClass": "Binding",
    "acceptanceMode": "PRE_COMMIT",
    "acceptedBy": "the escrow, for all its calls, at binding time"
  },
  "evidence": {
    "scope": "the deliverable and the acceptance criteria",
    "provision": "both parties provide material to the roster within the evidence window",
    "access": "content-addressed URIs",
    "verifiers": "the ERC-8436 roster",
    "retention": "until the hard deadline",
    "scopeHash": "0xaa5ad0a197a21ef520a68faefb09bb209a70bae0697e1d12728a6a2704fd7f70"
  },
  "effects": {
    "requested": [
      "0xe074020771795b0306209d2eb94e35a28bef8f823d7e65825aa3c0757e4626a9"
    ],
    "onSustained": "0xe074020771795b0306209d2eb94e35a28bef8f823d7e65825aa3c0757e4626a9",
    "onNotSustained": null,
    "fallbackRef": "0x59908be9e0c8081b785a87a2710908bb7da46e4e05ccc715447f3e81156b386e",
    "atMost": "the amount of call 17"
  },
  "subQuestions": [
    {
      "index": 0,
      "proposition": "0x39a1be8a1d985cc0ed38e86c2d35396a2bd3506192c20a93f3b58333d27f499f",
      "statement": "The deliverable conforms to the acceptance criteria.",
      "qType": "JUDGED",
      "obligationKind": 1,
      "dependsOn": []
    }
  ]
}
