{
  "kind": "adrf-case",
  "adrf": "0.1",
  "object": {
    "ref": {
      "chainId": 11155111,
      "target": "0x00000000000000000000000000000000000e5c20",
      "id": 17,
      "versionHash": "0x9856982c7581700f9dafd262324accb4a48263c20ccbfcdbfbddf522e117a5df"
    },
    "description": "service call 17 of the escrow, terms v1, committed model v2"
  },
  "event": {
    "eventRef": "0xbc06ebe2b69400cc4d7163a14266e22c11bda70a17e5b6e491931df471c7c597",
    "description": "the delivery of call 17",
    "eventAt": 1770003600
  },
  "claim": {
    "statement": "The service did not run the committed model version (v2) for call 17.",
    "proposition": "0x303ed8147bbd8b723fc71248571925479fc2363bac1b8bba54000d2ef99cb658",
    "decisive": 1,
    "supportsWhen": "FALSE"
  },
  "rules": {
    "normRef": "0x161c9f18675063b2f431db7a75036c6a863e0c9ec21fb74f9117af1b32b6d85c",
    "normDescription": "service terms v1",
    "clause": "0x4da352192b880b54a5c2fa6af21f3914675ee91d74e3db00738aecdc9ba61834",
    "clauseText": "the service runs the committed model version",
    "obligationKind": {
      "code": 1,
      "label": "result"
    },
    "policyId": "0x076505a99575bf1006c28609b6391f465246b7ded55d7a0d4eace05767a1b1b4"
  },
  "aiRelation": "which model version served an inference request of a model API service",
  "subjects": {
    "claimant": "0x000000000000000000000000000000000000c11e",
    "respondent": "0x00000000000000000000000000000000000009a0",
    "actor": {
      "ref": "0x6fef1cfbf3f96c4e46c0438d4ccdc4ec015c5363f5aab9c3304db91fc041a84d",
      "kind": "service",
      "description": "the model API endpoint that served the call"
    },
    "roles": [
      {
        "account": "0x000000000000000000000000000000000000c11e",
        "role": "client"
      },
      {
        "account": "0x00000000000000000000000000000000000009a0",
        "role": "provider (obligor of the version commitment)"
      }
    ]
  },
  "authorization": {
    "effectClass": "Binding",
    "acceptanceMode": "PRE_COMMIT",
    "acceptedBy": "the escrow, for all its calls, at binding time"
  },
  "evidence": {
    "scope": "the service logs and the audit material of call 17",
    "provision": "the provider makes the service log available to the panel; the client provides the response material",
    "access": "restricted access for the panel; redacted copies for the parties",
    "verifiers": "the attestor panel",
    "retention": "until the hard deadline",
    "scopeHash": "0x4ca57bcd35b50053f93e9a8073b0bc498cadcaa3d8e9e5872c122e9066e3f45a"
  },
  "context": {
    "committed": [
      "model v2 (terms v1)"
    ],
    "declared": [
      "model v2 (provider declaration at delivery)"
    ],
    "toEstablish": [
      "the version actually used for call 17"
    ],
    "unverifiedPremises": [
      "the service log provided is the log of call 17"
    ]
  },
  "participants": {
    "judgment": [
      {
        "role": "version verifier",
        "basis": "bound by the policy for (result, FORMAL)",
        "account": "0x0000000000000000000000000000000000000f04"
      },
      {
        "role": "attestor panel (2 of 3)",
        "basis": "bound by the policy for (any, EVIDENCED)"
      }
    ],
    "executors": [
      {
        "account": "0x00000000000000000000000000000000000e5c20",
        "authority": "holds the balances it moves"
      }
    ]
  },
  "effects": {
    "requested": [
      "0xe074020771795b0306209d2eb94e35a28bef8f823d7e65825aa3c0757e4626a9"
    ],
    "onSustained": "0xe074020771795b0306209d2eb94e35a28bef8f823d7e65825aa3c0757e4626a9",
    "onNotSustained": null,
    "fallbackRef": "0x59908be9e0c8081b785a87a2710908bb7da46e4e05ccc715447f3e81156b386e",
    "atMost": "the amount of call 17"
  },
  "subQuestions": [
    {
      "index": 0,
      "proposition": "0xb1e0895783a66395bbfa78783be54cc99df125fe2a9efcef18012b5561543c0e",
      "statement": "The version the provider declared at delivery differs from the committed version.",
      "qType": "FORMAL",
      "obligationKind": 1,
      "inputs": "abi.encode(uint256(17))",
      "inputsHash": "0x31ecc21a745e3968a04e9570e4425bc18fa8019c68028196b546d1669c200c68",
      "dependsOn": []
    },
    {
      "index": 1,
      "proposition": "0x2d8e3f52ac824ca6d665077925aae464860cc1996f5e9ce875725a2735c78f5b",
      "statement": "The version actually used for call 17 matches the committed version.",
      "qType": "EVIDENCED",
      "obligationKind": 1,
      "dependsOn": []
    }
  ]
}
